{
  "loker.run_id": "01f2a4e0-3b6f-7c8d-9e1a-2b3c4d5e6f70",
  "loker.event": "llm_call",
  "loker.phase": "design",
  "loker.attempt": 0,
  "timestamp": "2026-04-25T20:45:03Z",
  "gen_ai.system": "anthropic",
  "gen_ai.request.model": "claude-opus-4-7",
  "gen_ai.usage.input_tokens": 1843,
  "gen_ai.usage.output_tokens": 712,
  "gen_ai.response.finish_reasons": ["stop"]
}
